{"$schema": "aegraph/v1", "exportedAt": "2026-09-18T03:13:59.293Z", "project": "project:conversation-atlas", "tags": [{"tag": "register:curious", "color": "#ff9e64"}, {"tag": "register:focused", "color": "#ffc777"}, {"tag": "register:playful", "color": "#f78c6c"}, {"tag": "register:formal", "color": "#ffb86c"}, {"tag": "register:brief", "color": "#ff7b72"}, {"tag": "register:detailed", "color": "#5a6b9c"}, {"tag": "register:casual", "color": "#414868"}, {"tag": "register:technical", "color": "#6c7a9c"}, {"tag": "register:concise", "color": "#4a5273"}, {"tag": "register:reflective", "color": "#565f89"}, {"tag": "register:practical", "color": "#c98bd9"}, {"tag": "register:direct", "color": "#f7768e"}, {"tag": "register:exploratory", "color": "#7dcfb6"}, {"tag": "register:precise", "color": "#9ece6a"}, {"tag": "register:friendly", "color": "#f4a6c0"}, {"tag": "register:neutral", "color": "#8b93a8"}, {"tag": "register:opinionated", "color": "#e0af68"}, {"tag": "flag:starred", "color": "#f5c518", "description": "Starred in ChatGPT"}, {"tag": "region:code", "color": "#7aa2f7", "description": "Code"}, {"tag": "region:myth", "color": "#7dcfb6", "description": "Myth"}], "entities": [{"id": "project:conversation-atlas", "kind": "entity", "type": "project", "label": "Conversation Atlas", "description": "3 conversation segments from 2 ChatGPT conversations, semantically labelled and clustered by aegraph-chatgpt-pipeline.", "tags": [], "data": {"source": "import:aegraph-chatgpt-pipeline", "template": "conversation-atlas"}, "meta": {"createdAt": "2026-09-18T03:13:59.293Z", "updatedAt": "2026-09-18T03:13:59.293Z", "source": "import:aegraph-chatgpt-pipeline"}}, {"id": "type:segment", "kind": "entity", "type": "schema:type", "label": "Segment", "description": "One coherent topical stretch of a ChatGPT conversation, with its summary, excerpt and facets.", "tags": [], "data": {"name": "segment", "category": "resource", "color": "#10a37f", "pluralLabel": "Segments"}, "meta": {"createdAt": "2026-09-18T03:13:59.293Z", "updatedAt": "2026-09-18T03:13:59.293Z", "source": "import:aegraph-chatgpt-pipeline"}}, {"id": "type:topic", "kind": "entity", "type": "schema:type", "label": "Topic", "description": "A specific subject the segments are about (open facet).", "tags": [], "data": {"name": "topic", "category": "knowledge", "color": "#9ece6a", "pluralLabel": "Topics"}, "meta": {"createdAt": "2026-09-18T03:13:59.293Z", "updatedAt": "2026-09-18T03:13:59.293Z", "source": "import:aegraph-chatgpt-pipeline"}}, {"id": "type:domain", "kind": "entity", "type": "schema:type", "label": "Domain", "description": "A subject area (closed facet).", "tags": [], "data": {"name": "domain", "category": "knowledge", "color": "#7aa2f7", "pluralLabel": "Domains"}, "meta": {"createdAt": "2026-09-18T03:13:59.293Z", "updatedAt": "2026-09-18T03:13:59.293Z", "source": "import:aegraph-chatgpt-pipeline"}}, {"id": "type:theme", "kind": "entity", "type": "schema:type", "label": "Theme", "description": "The current under the surface topic (closed facet).", "tags": [], "data": {"name": "theme", "category": "knowledge", "color": "#bb9af7", "pluralLabel": "Themes"}, "meta": {"createdAt": "2026-09-18T03:13:59.293Z", "updatedAt": "2026-09-18T03:13:59.293Z", "source": "import:aegraph-chatgpt-pipeline"}}, {"id": "type:persona", "kind": "entity", "type": "schema:type", "label": "Persona", "description": "A self-designation the user wrote under.", "tags": [], "data": {"name": "persona", "category": "knowledge", "color": "#e0af68", "pluralLabel": "Personas"}, "meta": {"createdAt": "2026-09-18T03:13:59.293Z", "updatedAt": "2026-09-18T03:13:59.293Z", "source": "import:aegraph-chatgpt-pipeline"}}, {"id": "type:named-entity", "kind": "entity", "type": "schema:type", "label": "Named entity", "description": "A person, work, system or place the conversations mention.", "tags": [], "data": {"name": "named-entity", "category": "knowledge", "color": "#f7768e", "pluralLabel": "Named entities"}, "meta": {"createdAt": "2026-09-18T03:13:59.293Z", "updatedAt": "2026-09-18T03:13:59.293Z", "source": "import:aegraph-chatgpt-pipeline"}}, {"id": "type:cluster", "kind": "entity", "type": "schema:type", "label": "Cluster", "description": "A fine cluster of segments, found in the space of their labels.", "tags": [], "data": {"name": "cluster", "category": "knowledge", "color": "#2ac3de", "pluralLabel": "Clusters"}, "meta": {"createdAt": "2026-09-18T03:13:59.293Z", "updatedAt": "2026-09-18T03:13:59.293Z", "source": "import:aegraph-chatgpt-pipeline"}}, {"id": "type:region", "kind": "entity", "type": "schema:type", "label": "Region", "description": "A coarse region: clusters agglomerated and named.", "tags": [], "data": {"name": "region", "category": "knowledge", "color": "#ff9e64", "pluralLabel": "Regions"}, "meta": {"createdAt": "2026-09-18T03:13:59.293Z", "updatedAt": "2026-09-18T03:13:59.293Z", "source": "import:aegraph-chatgpt-pipeline"}}, {"id": "region:code", "kind": "entity", "type": "region", "label": "Code", "description": "code things", "tags": ["region:code"], "data": {"slug": "code", "size": 2, "keywords": ["topic:graphs"], "first_seen": "2023-11-14T22:13:20Z", "last_seen": "2023-11-14T22:13:22Z", "mean_salience": 4, "color": "#7aa2f7"}, "meta": {"createdAt": "2023-11-14T22:13:20Z", "updatedAt": "2023-11-14T22:13:22Z", "source": "import:aegraph-chatgpt-pipeline"}}, {"id": "region:myth", "kind": "entity", "type": "region", "label": "Myth", "description": "myth things", "tags": ["region:myth"], "data": {"slug": "myth", "size": 1, "keywords": ["entity:Eru"], "first_seen": "2023-11-16T02:00:00Z", "last_seen": "2023-11-16T02:00:01Z", "mean_salience": 4, "color": "#7dcfb6"}, "meta": {"createdAt": "2023-11-16T02:00:00Z", "updatedAt": "2023-11-16T02:00:01Z", "source": "import:aegraph-chatgpt-pipeline"}}, {"id": "cluster:graphs-0", "kind": "entity", "type": "cluster", "label": "Graphs", "tags": ["region:code", "cluster:graphs"], "data": {"slug": "graphs", "size": 2, "keywords": [], "region": "Code", "mean_salience": 4, "color": "#7aa2f7"}, "meta": {"createdAt": "2026-09-18T03:13:59.293Z", "updatedAt": "2026-09-18T03:13:59.293Z", "source": "import:aegraph-chatgpt-pipeline"}}, {"id": "cluster:graphs-0:::nested-in:::region:code", "kind": "relationship", "type": "nested-in", "tags": [], "data": {}, "meta": {"createdAt": "2026-09-18T03:13:59.293Z", "updatedAt": "2026-09-18T03:13:59.293Z", "source": "import:aegraph-chatgpt-pipeline"}, "source": {"id": "cluster:graphs-0"}, "target": {"id": "region:code"}, "directed": true}, {"id": "cluster:eru-1", "kind": "entity", "type": "cluster", "label": "Eru", "tags": ["region:myth", "cluster:eru"], "data": {"slug": "eru", "size": 1, "keywords": [], "region": "Myth", "mean_salience": 4, "color": "#7dcfb6"}, "meta": {"createdAt": "2026-09-18T03:13:59.293Z", "updatedAt": "2026-09-18T03:13:59.293Z", "source": "import:aegraph-chatgpt-pipeline"}}, {"id": "cluster:eru-1:::nested-in:::region:myth", "kind": "relationship", "type": "nested-in", "tags": [], "data": {}, "meta": {"createdAt": "2026-09-18T03:13:59.293Z", "updatedAt": "2026-09-18T03:13:59.293Z", "source": "import:aegraph-chatgpt-pipeline"}, "source": {"id": "cluster:eru-1"}, "target": {"id": "region:myth"}, "directed": true}, {"id": "segment:c1#0", "kind": "entity", "type": "segment", "label": "T c1#0", "description": "S c1#0", "tags": ["region:code", "cluster:graphs", "domain:software-engineering", "topic:graphs", "theme:order", "mode:inquiry", "entity:Eru", "stakes:low", "year:2023", "flag:starred", "salience:4"], "data": {"conversation_title": "Graphs", "conversation_id": "c1", "segment_index": 0, "segment_count": 2, "summary": "S c1#0", "question": "?", "excerpt": "graphs?", "created": "2023-11-14T22:13:20Z", "ended": "2023-11-14T22:13:21Z", "year": 2023, "month": "2023-11", "n_messages": 2, "n_user_messages": 1, "chars": 10, "model": "gpt-4o", "starred": true, "salience": 4, "stakes": "low", "mode": "inquiry", "region": "Code", "cluster": "Graphs", "facets": {"domain": ["software-engineering"], "topic": ["graphs"], "theme": ["order"], "intent": null, "mode": "inquiry", "register": null, "persona": null, "entity": ["Eru"], "artifact": null, "stakes": "low"}, "chatgpt_url": "https://chatgpt.com/c/c1"}, "meta": {"createdAt": "2023-11-14T22:13:20Z", "updatedAt": "2023-11-14T22:13:21Z", "source": "import:aegraph-chatgpt-pipeline"}}, {"id": "segment:c1#0:::in-region:::region:code", "kind": "relationship", "type": "in-region", "tags": [], "data": {}, "meta": {"createdAt": "2026-09-18T03:13:59.293Z", "updatedAt": "2026-09-18T03:13:59.293Z", "source": "import:aegraph-chatgpt-pipeline"}, "source": {"id": "segment:c1#0"}, "target": {"id": "region:code"}, "directed": true}, {"id": "segment:c1#0:::in-cluster:::cluster:graphs-0", "kind": "relationship", "type": "in-cluster", "tags": [], "data": {}, "meta": {"createdAt": "2026-09-18T03:13:59.293Z", "updatedAt": "2026-09-18T03:13:59.293Z", "source": "import:aegraph-chatgpt-pipeline"}, "source": {"id": "segment:c1#0"}, "target": {"id": "cluster:graphs-0"}, "directed": true}, {"id": "theme:order", "kind": "entity", "type": "theme", "label": "order", "tags": ["theme:order"], "data": {"facet": "theme", "value": "order", "segment_count": 2}, "meta": {"createdAt": "2026-09-18T03:13:59.293Z", "updatedAt": "2026-09-18T03:13:59.293Z", "source": "import:aegraph-chatgpt-pipeline"}}, {"id": "segment:c1#0:::has-theme:::theme:order", "kind": "relationship", "type": "has-theme", "tags": [], "data": {}, "meta": {"createdAt": "2026-09-18T03:13:59.293Z", "updatedAt": "2026-09-18T03:13:59.293Z", "source": "import:aegraph-chatgpt-pipeline"}, "source": {"id": "segment:c1#0"}, "target": {"id": "theme:order"}, "directed": true}, {"id": "domain:software-engineering", "kind": "entity", "type": "domain", "label": "software-engineering", "tags": ["domain:software-engineering"], "data": {"facet": "domain", "value": "software-engineering", "segment_count": 2}, "meta": {"createdAt": "2026-09-18T03:13:59.29